{
  "$schema": "schema/shop.schema.json",
  "$comment": "Лавка (как магазин AFK Arena): slots — 8 слотов, у каждого список товаров, из которых раз в день (и при ручном обновлении) выбирается один по весу weight среди доступных игроку. Цены в золоте и наборы опыта/золота растут с главой: ×(1 + chapterGrowth × номер главы с 0). Главная роль — сток золота, когда уровни дорожают; гемы — только за редкое (эпик, свиток, золото). Предмет товара — случайный этой редкости среди открытых в главе игрока (data/items → minChapter), поэтому эпик — с главы 2 (fromStage ch2_s1). Этап открытия — data/unlocks.json (shop). Баланс — docs/content/balance.md, «Лавка»; рецепт — docs/CONTENT_RECIPES.md, «Товары лавки». id товаров лежат в сохранениях (слоты дня) — не переименовывать. card_purple (фиолетовая карта за золото, с главы 6; BUG-168, 30.09): с главы 8 отряд упирается в потолки редкостей, а золото копится миллионами — Лавка превращает его в копии (1.05–1.5 млн в главах 7–10).",
  "slots": [
    ["gold_pack", "exp_small"],
    ["exp_small", "exp_large"],
    ["item_common", "item_rare"],
    ["item_common", "item_rare"],
    ["item_rare", "item_common", "item_epic"],
    ["card_blue", "exp_small", "card_purple"],
    ["item_rare", "card_blue_gems", "item_common"],
    ["scroll", "exp_large", "item_epic"]
  ],
  "refresh": {
    "gemCosts": [0, 20, 40, 80, 100],
    "maxPerDay": 5
  },
  "chapterGrowth": 1.0,
  "goods": [
    { "id": "exp_small", "kind": "heroExp", "count": 3000, "price": { "currency": "gold", "amount": 3000 }, "stock": 2, "weight": 6 },
    { "id": "exp_large", "kind": "heroExp", "count": 8000, "price": { "currency": "gold", "amount": 8000 }, "stock": 1, "weight": 4 },
    { "id": "gold_pack", "kind": "gold", "count": 4000, "price": { "currency": "gems", "amount": 20 }, "stock": 1, "weight": 3 },
    { "id": "item_common", "kind": "item", "rarity": "common", "price": { "currency": "gold", "amount": 1500 }, "stock": 1, "weight": 5 },
    { "id": "item_rare", "kind": "item", "rarity": "rare", "price": { "currency": "gold", "amount": 6000 }, "stock": 1, "weight": 3 },
    { "id": "item_epic", "kind": "item", "rarity": "epic", "price": { "currency": "gems", "amount": 150 }, "stock": 1, "weight": 1, "fromStage": "ch2_s1" },
    { "id": "card_blue", "kind": "heroCard", "cardRarity": "blue", "price": { "currency": "gold", "amount": 24000 }, "stock": 1, "weight": 3 },
    { "id": "card_blue_gems", "kind": "heroCard", "cardRarity": "blue", "price": { "currency": "gems", "amount": 120 }, "stock": 1, "weight": 1, "fromStage": "ch2_s1" },
    { "id": "card_purple", "kind": "heroCard", "cardRarity": "purple", "price": { "currency": "gold", "amount": 150000 }, "stock": 1, "weight": 2, "fromStage": "ch6_s1" },
    { "id": "scroll", "kind": "scrolls", "count": 1, "price": { "currency": "gems", "amount": 27 }, "stock": 1, "weight": 1, "perDay": 1 }
  ]
}
